## DISABLE_FAST_SQL_PARSER
create table tb1 (
id int primary key
) partition by key(id);
# TSO + RR should use parallel write
set TRANSACTION_POLICY='TSO';
set TX_ISOLATION='REPEATABLE-READ';
set TRANSACTION_ISOLATION='REPEATABLE-READ';
delete from tb1;
begin;
trace insert into tb1 values (1), (2), (3), (4), (5), (6), (7), (8), (9), (10);
select count(0) > 0 from information_schema.trace where GROUP_CONN_ID > 0;
count(0) > 0
1
show variables like 'trx_class';
Variable_name,Value
TRX_CLASS,TsoTransaction
show variables like 'transaction_isolation';
Variable_name,Value
transaction_isolation,REPEATABLE-READ
rollback;
# TSO + RC should not use parallel write
set TRANSACTION_POLICY='TSO';
set TX_ISOLATION='READ-COMMITTED';
set TRANSACTION_ISOLATION='READ-COMMITTED';
delete from tb1;
begin;
trace insert into tb1 values (1), (2), (3), (4), (5), (6), (7), (8), (9), (10);
select count(0) > 0 from information_schema.trace where GROUP_CONN_ID > 0;
count(0) > 0
0
show variables like 'trx_class';
Variable_name,Value
TRX_CLASS,TsoTransaction
show variables like 'transaction_isolation';
Variable_name,Value
transaction_isolation,READ-COMMITTED
rollback;
# XA + RR should use parallel write
set TRANSACTION_POLICY='XA';
set enable_xa_tso = false;
set TX_ISOLATION='REPEATABLE-READ';
set TRANSACTION_ISOLATION='REPEATABLE-READ';
delete from tb1;
begin;
trace insert into tb1 values (1), (2), (3), (4), (5), (6), (7), (8), (9), (10);
select count(0) > 0 from information_schema.trace where GROUP_CONN_ID > 0;
count(0) > 0
1
show variables like 'trx_class';
Variable_name,Value
TRX_CLASS,XATransaction
show variables like 'transaction_isolation';
Variable_name,Value
transaction_isolation,REPEATABLE-READ
rollback;
# XA + RC should not use parallel write
set TRANSACTION_POLICY='XA';
set enable_xa_tso = false;
set TX_ISOLATION='READ-COMMITTED';
set TRANSACTION_ISOLATION='READ-COMMITTED';
delete from tb1;
begin;
trace insert into tb1 values (1), (2), (3), (4), (5), (6), (7), (8), (9), (10);
select count(0) > 0 from information_schema.trace where GROUP_CONN_ID > 0;
count(0) > 0
0
show variables like 'trx_class';
Variable_name,Value
TRX_CLASS,XATransaction
show variables like 'transaction_isolation';
Variable_name,Value
transaction_isolation,READ-COMMITTED
rollback;
# XA_TSO + RR should use parallel write
set TRANSACTION_POLICY='XA';
set enable_xa_tso = true;
set TX_ISOLATION='REPEATABLE-READ';
set TRANSACTION_ISOLATION='REPEATABLE-READ';
delete from tb1;
begin;
trace insert into tb1 values (1), (2), (3), (4), (5), (6), (7), (8), (9), (10);
select count(0) > 0 from information_schema.trace where GROUP_CONN_ID > 0;
count(0) > 0
1
show variables like 'trx_class';
Variable_name,Value
TRX_CLASS,XATsoTransaction
show variables like 'transaction_isolation';
Variable_name,Value
transaction_isolation,REPEATABLE-READ
rollback;
# XA_TSO + RC should not use parallel write
set TRANSACTION_POLICY='XA';
set enable_xa_tso = true;
set TX_ISOLATION='READ-COMMITTED';
set TRANSACTION_ISOLATION='READ-COMMITTED';
delete from tb1;
begin;
trace insert into tb1 values (1), (2), (3), (4), (5), (6), (7), (8), (9), (10);
select count(0) > 0 from information_schema.trace where GROUP_CONN_ID > 0;
count(0) > 0
0
show variables like 'trx_class';
Variable_name,Value
TRX_CLASS,XATsoTransaction
show variables like 'transaction_isolation';
Variable_name,Value
transaction_isolation,READ-COMMITTED
rollback;
drop table tb1;