## DISABLE_FAST_SQL_PARSER
SET ENABLE_FOREIGN_KEY = true;
create table parent (
a int primary key auto_increment,
b int,
c int,
unique(b) using hash,
index(c)) engine = innodb;
create table child (
a int primary key auto_increment,
b int,
c int,
unique(b) using hash,
index(c)) engine = innodb;
###
  ### UK vs UK
  ###
alter table child add constraint fkname foreign key (b) references parent(b) on delete restrict on update cascade;
insert into parent values (1,1,1), (2,2,2);
insert into child values (1,1,1),(2,2,2);
begin;
update parent set b = 1 where a = 1;
select * from child order by 1,2,3;
a,b,c
1,1,1
2,2,2
rollback;
begin;
update parent set b = null where a = 1;
select * from child order by 1,2,3;
a,b,c
1,null,1
2,2,2
rollback;
begin;
update parent set b = 3 where a = 1;
select * from child order by 1,2,3;
a,b,c
1,3,1
2,2,2
rollback;
delete from child;
delete from parent;
alter table child drop foreign key fkname;
###
  ### UK vs OI
  ###
alter table child add constraint fkname foreign key (c) references parent(b) on delete restrict on update cascade;
insert into parent values (1,1,1),(2,2,2);
insert into child values (1,1,1),(2,2,2),(3,3,1),(4,4,2);
begin;
update parent set b = null where a = 1;
select * from child order by 1,2,3;
a,b,c
1,1,null
2,2,2
3,3,null
4,4,2
rollback;
begin;
update parent set b = 3 where a = 1;
select * from child order by 1,2,3;
a,b,c
1,1,3
2,2,2
3,3,3
4,4,2
rollback;
delete from child;
delete from parent;
alter table child drop foreign key fkname;
drop table child;
drop table parent;